id,category,difficulty,stem,opt_a,opt_b,opt_c,opt_d,correct,case,rule_id,prong,explanation,tags,daily_eligible
roa-106,roa,3,Bush v. Lucas declined to recognize a Bivens remedy for First Amendment retaliation by a federal supervisor because:,"Government employment is a privilege, not a right",The civil-service remedial scheme provided an adequate alternative,The First Amendment is not self-executing,Congress had specifically barred Bivens actions in this context,b,bush-lucas,,,"Bush began the Court's retreat from Bivens — adequate alternative remedies (here, civil-service review) defeat extension.",bush-lucas;alternative,false
roa-107,roa,4,Egbert v. Boule's two-step is best understood as:,"A reaffirmation of Bivens, Davis, and Carlson with broader application",An overruling of Bivens for Fourth Amendment claims,A collapsed test where any rational reason for Congressional preference defeats Bivens extension,A narrowing of the special-factors analysis to military and national-security cases,c,egbert,bivens-extension,,Egbert effectively collapsed the two-step into a single inquiry; any rational reason for deferring to Congress now bars extension. Bivens's core (4A in homes) survives; nearly all extensions fail.,egbert;test,true
roa-108,roa,4,Hernandez v. Mesa declined to extend Bivens to a cross-border shooting because:,The plaintiff lacked Article III standing,The Fourth Amendment does not apply extraterritorially,Mexico had jurisdiction over the underlying conduct,The case presented a new context with foreign-relations special factors counseling hesitation,d,hernandez,bivens-extension,,Hernandez applied the special-factors analysis; foreign-relations and national-security concerns weighed heavily against extension.,hernandez;extension,false
roa-109,roa,4,Correctional Services Corp. v. Malesko declined to extend Bivens to a private corporation operating a federal prison because:,Federal courts lack subject-matter jurisdiction over private actors,Private corporations are not federal officers within the meaning of Bivens,Private corporations are entitled to absolute immunity from constitutional torts,The plaintiff had alternative remedies in state law and prison administrative procedures,d,malesko,,,"Malesko found alternative remedies (state tort law, BOP administrative remedies) sufficient to defeat Bivens against private corporate operators.",malesko;private,false
roa-110,roa,4,Carlson v. Green extended Bivens to an Eighth Amendment medical-care claim by a federal inmate. The Court reasoned that the FTCA was insufficient because:,Congress had not yet enacted the FTCA at the time of suit,"FTCA recovery is governed by state tort law, while Bivens damages provide uniform federal redress",FTCA does not permit recovery for constitutional torts,FTCA's exhaustion requirements unduly delayed recovery,b,carlson,,,"Carlson distinguished FTCA (state-law-based, no punitives, sovereign-immunity wrinkles) from Bivens (uniform federal damages directly against officer).",carlson;ftca,false
roa-111,roa,2,Bivens supplies the federal cause of action for constitutional damages claims that § 1983 does not reach because § 1983:,Requires exhaustion of administrative remedies,Is limited to Fourth Amendment violations,Does not authorize money damages,"Reaches only persons acting under color of state law, not federal officers",d,bivens,,,§ 1983 reaches state actors; Bivens fills the federal-officer gap (subject to current narrow application).,bivens;1983,false
roa-112,roa,4,Schweiker v. Chilicky declined to extend Bivens to claims that SSA's denial of disability benefits violated due process. The Court reasoned that:,The plaintiffs had been fully compensated through SSA's procedures,"Due-process claims may only be brought against state, not federal, actors",Constitutional torts in benefits programs are categorically nonjusticiable,Congress's elaborate statutory remedial scheme demonstrated its intent that this be the exclusive remedy,d,,,,Schweiker rejected Bivens because Congress's comprehensive SSA scheme — even without compensatory damages for due-process violations — implied no judicially-created remedy.,schweiker;alternative,false
roa-113,roa,3,The four-factor test from Cort v. Ash for implied private rights of action included:,"Necessity, particularity, redressability, and substantial federal interest","Private right, public benefit, fit with comprehensive scheme, and judicial economy","Express text, agency interpretation, history of enforcement, and Congressional acquiescence","Class benefited, legislative intent, fit with statutory purpose, and federalism considerations",d,cort-ash,cort-ash,,Cort v. Ash's four-factor analysis: (1) plaintiff in benefited class; (2) legislative intent; (3) fit with purpose; (4) traditional state-law area. Largely supplanted by Sandoval.,cort-ash;factors,false
roa-114,roa,5,"A federal Border Patrol agent assaults an innkeeper, asserting authority over property near the Canadian border. The innkeeper sues under Bivens for First and Fourth Amendment violations. After Egbert v. Boule:",The claim depends on whether the FTCA applies extraterritorially to Border Patrol,The claim succeeds because the conduct fits Bivens' core Fourth Amendment context,The claim almost certainly fails because any rational reason for Congressional preference defeats Bivens here,The claim succeeds for the Fourth Amendment but not the First,c,egbert,bivens-extension,,Egbert dealt with this exact factual context and rejected Bivens. The 'rational reason' standard makes Bivens extensions effectively unavailable.,egbert;hypo,true
roa-115,roa,3,"Even after Egbert, federal courts retain authority to:",Award Bivens damages in any 'special factors-free' case,Order federal-treasury damages payments without congressional authorization,Issue equitable injunctive relief against federal officers' ongoing constitutional violations,Imply damages remedies under federal regulatory statutes,c,,,,"Bivens addresses damages; equitable relief against ongoing constitutional violations remains available under traditional equitable principles, separate from Bivens doctrine.",bivens;injunction,false
roa-116,roa,5,Wilkie v. Robbins declined to extend Bivens to a rancher's harassment claims against BLM officers. A central reason was:,The unworkability of an unconstitutional-retaliation Bivens action without a clear standard,Property-rights disputes are governed exclusively by state law,The rancher had not exhausted administrative remedies,Federal officers lack capacity to harass under federal law,a,wilkie,,,"Wilkie identified 'special factors' including administrability — a freestanding retaliation claim required courts to police any federal-officer conduct, an unworkable standard.",wilkie;extension,false
imm-101,imm,3,Hans v. Louisiana extended state sovereign immunity to suits by:,Foreign sovereigns raising any federal claim,"Out-of-state citizens raising federal claims, consistent with 11A text","A state's own citizens raising federal claims, despite the 11th Amendment's text addressing only out-of-state plaintiffs",Federal officers in their official capacity,c,hans,,,"Hans read 11A's penumbra to bar even in-state citizen federal claims, reasoning from the original presumption of state sovereign immunity.",hans;ssi,false
imm-102,imm,2,"A plaintiff sues a state's attorney general in federal court seeking an injunction against enforcement of a state statute alleged to violate the U.S. Constitution. Under Ex parte Young, this is:",Permitted only if the state has waived sovereign immunity,Permitted because the suit seeks prospective relief against an officer alleged to be acting unconstitutionally,Barred by the 11th Amendment because the state is the real party in interest,Permitted only if Congress has expressly authorized the suit,b,expaul,ex-parte-young,,Ex parte Young's officer-suit fiction permits prospective injunctive relief; an officer enforcing an unconstitutional law is stripped of state immunity for that purpose.,young;black-letter,false
imm-103,imm,3,Edelman v. Jordan distinguishes Ex parte Young from suits seeking:,Declaratory judgment about the state's federal-law obligations,Retroactive money damages payable from the state treasury,Injunctive relief against state officers in their personal capacities,Prospective compliance with federal law going forward,b,edelman,,,"Edelman: Young permits prospective relief but bars retroactive damages from state treasury, even when styled as compliance.",edelman;remedy,false
imm-104,imm,4,Pennhurst v. Halderman held that Ex parte Young does NOT permit:,Federal-court injunctive enforcement of state law against state officers,Class-action habeas claims,Federal-question suits against state officers,Damages claims against state officers in personal capacity,a,pennhurst,,,Pennhurst: federal courts cannot use Young to enforce state law against state officials — that would intrude on state sovereignty without supremacy-clause warrant.,pennhurst;young,false
imm-105,imm,3,"After Seminole Tribe v. Florida, Congress may abrogate state sovereign immunity:",Under any enumerated power so long as state interests are not unduly burdened,Only with consent of the Conference of Chief Justices,"Only under § 5 of the 14th Amendment, not under Article I commerce powers",Whenever it makes a clear statement,c,seminole,seminole-abrog,,Seminole Tribe held that Article I powers cannot abrogate SSI; § 5 of the 14th Amendment can (Fitzpatrick).,seminole;abrogation,true
imm-106,imm,4,Central Virginia Community College v. Katz upheld bankruptcy proceedings against state interests because:,Congress validly abrogated SSI under § 5 of the 14th Amendment,Bankruptcy is a public-rights matter outside state immunity,The 11th Amendment does not address Article I bankruptcy,States consented to federal bankruptcy jurisdiction in the plan of the constitutional convention,d,katz,plan-conv,,Katz reasoned that ratification of the Bankruptcy Clause implicitly waived state immunity for bankruptcy proceedings — the 'plan of convention' theory.,katz;plan-of-convention,false
imm-107,imm,4,Torres v. Texas Department of Public Safety extended the plan-of-convention reasoning to:,Suits enforcing federal employment protections under congressional war powers,Suits enforcing the Spending Clause as applied to states,Suits enforcing federal admiralty law against state actors,Suits enforcing the Equal Protection Clause directly,a,torres,plan-conv,,Torres held that states yielded sovereign immunity for war-power-based federal claims (USERRA) under the plan of convention.,torres;abrogation,false
imm-108,imm,2,Monroe v. Pape held that § 1983 reaches:,Federal officials acting jointly with state officials,Only state officials in their official capacity,"State officials acting under color of state law, even when violating state law",Only state officials acting within the scope of their authority,c,monroe,,,Monroe interpreted 'under color of' broadly to reach abuses of authority — the heart of § 1983 enforcement against rogue officers.,monroe;color,false
imm-109,imm,2,Monell v. NYC Department of Social Services held that a municipality is liable under § 1983:,Only in suits seeking injunctive relief,Whenever the municipality fails to indemnify the offending employee,Whenever an employee acts under color of municipal authority,Only when the deprivation arises from a policy or custom — not under respondeat superior,d,monell,monell-mun,,Monell's foundational rule: municipalities are 'persons' under § 1983 but liable only for policy/custom-based violations.,monell;municipality,false
imm-110,imm,3,Will v. Michigan State Police held that:,State courts lack jurisdiction over § 1983 claims,§ 1983 does not reach state-law claims,State officials are categorically immune from § 1983 personal-capacity suits,States and state agencies are not 'persons' under § 1983,d,will,,,"Will applied a clear-statement rule and concluded states/agencies aren't 'persons' for § 1983 damages, sidestepping 11A in the suit's framing.",will;person,false
imm-111,imm,3,Hafer v. Melo distinguished Will by holding that state officers sued in their personal capacity:,Are 'persons' under § 1983 even when their challenged acts were taken in office,May raise the state's sovereign immunity defense,Are immune unless they exceeded their authority under state law,Are entitled to compensation from state treasury upon judgment,a,hafer,,,"Hafer made personal-capacity suits viable: the official is the 'person' regardless of when conduct occurred, and the state's SSI does not transfer.",hafer;capacity,false
imm-112,imm,4,Health & Hospital Corp. v. Talevski (2023) held that:,Talevski overruled Gonzaga,Spending-Clause statutes can create rights enforceable under § 1983 when the text uses rights-creating language,Spending-Clause statutes never create § 1983-enforceable rights,Only Spending-Clause statutes that expressly permit private suits are § 1983-enforceable,b,talevski,sec1983-rights,,Talevski reaffirmed Gonzaga's rights-creating-language test and held that the Federal Nursing Home Reform Act met it; Spending-Clause origin is not categorically disqualifying.,talevski;1983,true
imm-113,imm,3,Harlow v. Fitzgerald replaced the prior subjective good-faith standard with:,An objective test: whether a reasonable officer would have known the conduct violated clearly established law,A balancing test weighing the right's importance against enforcement costs,A categorical rule extending absolute immunity to all discretionary acts,A purely procedural test focusing on whether qualified-immunity was raised early,a,harlow,harlow-qi,,Harlow's objective test — clearly established law a reasonable officer would have known — defines modern qualified immunity.,harlow;qi,false
imm-114,imm,3,Pearson v. Callahan modified Saucier v. Katz by holding that lower courts:,May decide either prong of the qualified-immunity inquiry first,Must defer to the prosecutor's good-faith assessment of clearly established law,Lack discretion to grant summary judgment on QI grounds before trial,Must always decide the constitutional question first,a,pearson,,,"Pearson made Saucier's mandatory two-step optional, allowing courts to skip the constitutional question if QI is otherwise clear.",pearson;qi,false
imm-115,imm,3,Prosecutors have absolute immunity for advocacy functions but only qualified immunity for investigative tasks. The line between them was articulated in:,Harlow v. Fitzgerald and Anderson v. Creighton,Stump v. Sparkman and Pierson v. Ray,Saucier v. Katz and Pearson v. Callahan,Imbler v. Pachtman and Buckley v. Fitzsimmons,d,imbler,,,Imbler established absolute prosecutorial immunity for advocacy; Buckley clarified that pre-charge investigative work falls outside that protection.,prosecutor;immunity,false
imm-116,imm,4,Trump v. United States (2024) held that the President's criminal immunity:,Is absolute for all conduct during the presidential term,Does not exist; Presidents may be prosecuted for any act,Is absolute for core official acts and presumptive for other official conduct,Depends on whether the conduct was authorized by the Vice President,c,trump-us,,,"Trump v. United States announced an absolute/presumptive structure for criminal immunity: absolute for core constitutional functions, presumptive for outer official conduct, none for unofficial acts.",trump;immunity,true
hab-101,hab,3,"Under AEDPA § 2254(d)(1), federal habeas relief from a state-court adjudication on the merits requires that the state decision was:","Erroneous, regardless of whether reasonable jurists could disagree",Subject to plain-error review under federal procedural standards,Based on an interpretation of state law inconsistent with federal precedent,Contrary to or an unreasonable application of clearly established federal law,d,williams-taylor,aedpa-2254d,,"§ 2254(d)(1) sets up a deferential 'contrary to / unreasonable application' standard, not de novo review.",aedpa;deference,true
hab-102,hab,4,Williams v. Taylor distinguished 'contrary to' from 'unreasonable application' as follows:,The two prongs are functionally identical and should be treated as one,'Contrary to' is reviewed de novo; 'unreasonable application' is reviewed for clear error,'Contrary to' applies to facts; 'unreasonable application' applies to law,'Contrary to' applies when the state court reached a conclusion opposite to clearly established law on materially indistinguishable facts; 'unreasonable application' applies when the state court correctly identified the rule but applied it unreasonably,d,williams-taylor,aedpa-2254d,,"Williams' canonical articulation of the AEDPA standards. 'Contrary to' = wrong rule or opposite outcome on indistinguishable facts. 'Unreasonable application' = right rule, unreasonable application.",williams;aedpa,false
hab-103,hab,4,Cullen v. Pinholster restricted federal habeas review under § 2254(d)(1) to:,Any record developed in subsequent state collateral review,"The combined state and federal records, with deference to state findings","The federal-habeas record, including evidence developed in federal court",The record before the state court at the time of its merits adjudication,d,pinholster,aedpa-2254d,,"Pinholster: when a state court adjudicated on the merits, federal § 2254(d)(1) review is limited to the state-court record, sharply curtailing new-evidence development.",pinholster;aedpa,false
hab-104,hab,3,Wainwright v. Sykes replaced Fay v. Noia's deliberate-bypass standard with:,A pure exhaustion requirement,A discretionary 'interests of justice' test,A cause-and-prejudice standard for procedural defaults,AEDPA's deference standard,c,wainwright,default-cause,,Wainwright tightened the procedural-default doctrine: petitioners must show external cause and actual prejudice (or a fundamental miscarriage gateway).,wainwright;default,false
hab-105,hab,4,Coleman v. Thompson held that attorney error in:,Direct appeal automatically constitutes cause for default,Capital sentencing automatically constitutes cause regardless of stage,"State collateral proceedings is generally not 'cause' for procedural default, because there is no constitutional right to counsel there",Federal habeas proceedings is cause for default of state-court issues,c,coleman-thomp,default-cause,,Coleman: no constitutional right to counsel in state collateral review means attorney error there isn't 'cause' (Martinez carved a narrow exception).,coleman;default,false
hab-106,hab,4,Martinez v. Ryan recognizes a narrow cause exception when:,The petitioner was unrepresented during trial,"A state requires an ineffective-assistance claim to be raised first on initial-review collateral, and counsel was ineffective there",The federal habeas court concludes the conviction was clearly erroneous,State direct-review counsel failed to raise an issue on direct appeal,b,martinez,default-cause,,"Martinez's narrow exception: where state procedural rules effectively make initial-review collateral the only forum for IATC claims, ineffective collateral-review counsel can be 'cause.'",martinez;exception,false
hab-107,hab,4,"Under Teague v. Lane, a 'new rule' is generally not applied retroactively on collateral review except for:",Any rule announced after the conviction became final,Rules announced by the Supreme Court (but not lower federal courts),Rules expressly designated retroactive by Congress,"Substantive rules placing certain conduct beyond the criminal law's reach, and rare watershed procedural rules",d,teague,teague-retro,,Teague's two narrow exceptions: substantive rules and watershed procedural rules. Watershed rules have been almost theoretical.,teague;retroactivity,false
hab-108,hab,4,Stone v. Powell bars federal habeas review of:,All Fourth Amendment claims regardless of state-court procedure,Sixth Amendment claims raised for the first time on collateral review,"Fourth Amendment exclusionary-rule claims, where the state provided a full and fair opportunity to litigate",Fifth Amendment self-incrimination claims after Miranda,c,stone-powell,,,Stone's narrow rule: Fourth Amendment exclusionary claims are not cognizable on habeas if the state provided full and fair litigation opportunity.,stone;4a,false
hab-109,hab,4,McQuiggin v. Perkins held that a credible actual-innocence showing:,Is unavailable as a gateway under modern habeas doctrine,Excuses AEDPA's one-year statute of limitations,"Operates only to excuse procedural default, not the AEDPA SOL","Requires DNA evidence, not just affidavits",b,mcquiggin,,,McQuiggin extended Schlup's actual-innocence gateway to AEDPA's SOL: a credible innocence claim equitably tolls the limitations period.,mcquiggin;innocence,false
hab-110,hab,4,Boumediene v. Bush held that:,The Suspension Clause has no extraterritorial reach,The Detainee Treatment Act provides an adequate substitute for habeas in all cases,Habeas is unavailable to non-citizens,The Suspension Clause limits Congress's ability to strip habeas jurisdiction over Guantanamo detainees,d,boumediene,,,"Boumediene held that Guantanamo detainees enjoy Suspension Clause-protected habeas, and the MCA's substitute review was inadequate.",boumediene;suspension,false
just-201,just,4,A federal employee files a § 1983-style suit alleging that her supervisor's general workplace policies harm 'all employees.' She does not allege any concrete consequence to herself. The strongest standing argument against her is:,Her supervisor enjoys absolute immunity under federal-employment law,The political question doctrine bars review of internal personnel matters,She failed to exhaust administrative remedies before filing suit,Her injury is shared by all federal employees alike — a generalized grievance,d,richardson,,,"Generalized grievances shared by the public (or here, all employees) lack the particularization Article III requires. The other options misframe the doctrinal hook.",standing;generalized,false
just-202,just,4,"During a class-action challenge to an unconstitutional probation policy, the named plaintiff completes probation. The class has not yet been certified. The court should:",Treat the class as automatically certified upon the named plaintiff's mootness,Apply 'relation back' principles and consider whether the dispute is capable of repetition yet evading review,Order the state to identify a substitute plaintiff before considering certification,Dismiss the entire action as moot because the named plaintiff has no live claim,b,laidlaw,,mootness,"Sosna and progeny: a moot named plaintiff's claim can 'relate back' to certification, especially where the dispute is short-duration and recurring (capable of repetition exception).",mootness;class,false
just-203,just,4,A national labor union files a pre-enforcement challenge against a new statute requiring members to disclose political contributions. No member has yet been prosecuted. The court should find the case ripe:,Only if the union can identify members who plan to violate,If members face a credible threat of prosecution that chills their First Amendment activity,Only after the first prosecution under the statute,Whenever the legal question is purely one of statutory interpretation,b,sba-driehaus,,ripeness,SBA List v. Driehaus permits pre-enforcement First Amendment challenges where credible threat plus chilling effect on protected conduct are alleged.,ripeness;chilling,false
just-204,just,3,"An environmental NGO sues on behalf of unnamed members alleging harm to a national park. To establish associational standing, the group must show:",The organization has incorporated and registered as a 501(c)(3),The membership has formally voted to authorize the litigation,Members would have standing in their own right; the interest is germane to the org's purpose; relief does not require individual member participation,"Each member has individually demonstrated injury, traceability, and redressability",c,,,,Hunt v. Washington Apple's three-prong test for associational standing. Individual injury showings are NOT required if all three Hunt factors are met.,associational-standing,false
just-205,just,4,"A consumer sues a credit reporting agency under FCRA, alleging the agency maintained inaccurate information about her in its files. She does not allege the inaccuracy was ever transmitted to a third party. After Spokeo and TransUnion, she:",Has standing because Congress provided a private right of action under FCRA,Has standing because the inaccurate file is itself a concrete intangible injury,Has standing only if she can prove the inaccuracy caused emotional distress,Lacks standing because the harm has no close historical analog absent publication,d,transunion,,injury-in-fact,"TransUnion: even with a Congressionally-created cause of action, the plaintiff must show concrete harm with a close historical or common-law analog. Retention without publication has no defamation analog.",transunion;spokeo,true
just-206,just,4,"A coastal state sues the federal government to challenge an EPA rule that allegedly under-regulates emissions, citing Massachusetts v. EPA's 'special solicitude.' Post-Massachusetts cases suggest the state's argument:",Will fail because climate-change harms are nonjusticiable political questions,Will face skepticism; special solicitude has not been broadly extended,Will succeed automatically because states inherently have standing,Depends on whether Congress expressly authorized the state to sue,b,mass-epa,,injury-in-fact,"Massachusetts v. EPA's 'special solicitude' has been read narrowly in subsequent cases (e.g., AHM, Murthy). States get some deference but not a categorical pass.",mass-epa;states,false
