id,category,difficulty,stem,opt_a,opt_b,opt_c,opt_d,correct,case,rule_id,prong,explanation,tags,daily_eligible
scsr-017,scsr,3,Why is state-court enforcement of federal law not unconstitutional commandeering?,The state court's interpretation of state law is not reviewable,State courts are different from political branches; they enforce existing law,Dice v. Akron requires federal procedural law to govern,An antecedent state-law issue may be reviewed where it determines a federal right,b,ferc-ms,,state-courts,Distinction drawn in FERC v. Mississippi.,ferc-ms;state-courts,false
scsr-018,scsr,3,McKnett v. St. Louis & SF prohibited:,Discrimination between federal and analogous state-law claims,The state-court judgment rests on adequate and independent state grounds,The federal issue was not raised below and is therefore unreviewable,The state's neutral excuse is insufficient under Howlett v. Rose,a,mcknett,,state-courts,States cannot create asymmetric jurisdiction favoring state law.,mcknett;state-courts,false
scsr-019,scsr,3,Douglas v. NY illustrates a 'valid excuse' for state-court refusal:,The federal issue was not raised below and is therefore unreviewable,Forum-non-conveniens-like dismissal applied evenhandedly,Refusal under federal preemption,The state's neutral excuse is insufficient under Howlett v. Rose,b,douglas,,state-courts,Neutral non-discriminatory dismissals OK.,douglas;valid-excuse,false
scsr-020,scsr,3,Dice v. Akron preempted state procedural rule because:,FELA was unconstitutional,An antecedent state-law issue may be reviewed where it determines a federal right,Dice v. Akron requires federal procedural law to govern,It defeated federal substantive policy,d,dice,,state-procedure,State release-validity rule defeated FELA's worker-protective purposes.,dice;procedure,false
scsr-021,scsr,3,Bombolis allowed state non-unanimous jury rule because:,FELA preempted,Michigan v. Long's presumption authorizes Supreme Court review,Procedural rule didn't defeat federal substantive policy,The state procedural ground is novel and inadequate to bar review,c,bombolis,,state-procedure,Unanimous-jury preference wasn't part of FELA's substantive policy.,bombolis;procedure,false
scsr-022,scsr,3,Felder v. Casey preempted Wisconsin notice-of-claim rule because:,The state-court judgment rests on adequate and independent state grounds,Diversity controlled,Michigan v. Long's presumption authorizes Supreme Court review,It burdened § 1983 enforcement,d,felder,,state-procedure,State notice-of-claim rule preempted in § 1983 actions.,felder;1983,false
scsr-023,scsr,4,'Hypo: State court refuses to apply state collateral-estoppel rule against state defendant in § 1983 case but applies it elsewhere.' Analysis:,The federal issue was not raised below and is therefore unreviewable,Likely discriminatory; preempted,Always allowed,Murdock v. Memphis limits review to federal-law questions only,b,haywood,,state-procedure,Discrimination against federal claims preempted.,hypo;state-procedure,false
scsr-025,scsr,3,Burden of proof in FELA cases must be:,The state procedural ground is novel and inadequate to bar review,Federal,Felder v. Casey preempts the discriminatory state procedural rule,The state's neutral excuse is insufficient under Howlett v. Rose,b,,,state-procedure,Central Vermont v. White: burden of proof is part of federal substantive law.,burden-of-proof;procedure,false
scsr-026,scsr,3,A 'valid excuse' for declining federal claims must be:,Express in state statute,Neutral and non-discriminatory,Constitutional,The state-court judgment rests on adequate and independent state grounds,b,douglas,,state-courts,"Douglas/Herb permit neutral, generally applicable dismissals.",valid-excuse;state-courts,false
scsr-028,scsr,3,Murdock's rule reflects:,The federal issue was not raised below and is therefore unreviewable,The state procedural ground is novel and inadequate to bar review,Limits on SC's role in state-law issues,An antecedent state-law issue may be reviewed where it determines a federal right,c,murdock,,sc-review,Federalism-protective limit on SC review.,murdock;federalism,false
scsr-030,scsr,3,Fox Films v. Muller's reasoning:,The state-court judgment rests on adequate and independent state grounds,Reviewing state-law-supported judgment would be advisory,The state procedural ground is novel and inadequate to bar review,The federal issue was not raised below and is therefore unreviewable,b,fox-films,,a-and-i,AO concern: SC's federal ruling wouldn't change outcome.,fox-films;ao,false
scsr-031,scsr,3,Michigan v. Long's rationale was:,The federal issue was not raised below and is therefore unreviewable,Bright-line rule favoring SC review,States are paramount,The state's neutral excuse is insufficient under Howlett v. Rose,b,michigan-long,mich-long,a-and-i,Bright line ensures SC reviews properly even with mixed state-federal opinions.,michigan-long;rationale,false
scsr-032,scsr,3,'Antecedent' state-law issues under Brand are:,Michigan v. Long's presumption authorizes Supreme Court review,Fox Films bars review where state ground supports the result,Logically prior to federal-law analysis and reviewable,The state's neutral excuse is insufficient under Howlett v. Rose,c,brand,,a-and-i,"E.g., did a contract form? — antecedent to federal contract-impairment claim.",brand;antecedent,false
scsr-033,scsr,3,SC review of state courts requires the federal issue to be:,"Properly raised, fairly preserved",Constitutional only,Testa v. Katt requires state courts to enforce the federal claim,Michigan v. Long's presumption authorizes Supreme Court review,a,cardinale,,sc-review,Cardinale's preservation rule.,cardinale;preservation,false
scsr-034,scsr,3,A 'novel' state procedural ground may be:,Constitutional,Inadequate to bar SC review,Michigan v. Long's presumption authorizes Supreme Court review,Always adequate,b,naacp-al,,a-and-i,NAACP v. Alabama: novel applications can't immunize state actions from federal review.,naacp-al;novel,false
scsr-035,scsr,3,Why does the SC defer to state-law interpretations of state law?,An antecedent state-law issue may be reviewed where it determines a federal right,Federalism / state sovereignty,Murdock v. Memphis limits review to federal-law questions only,The state-court judgment rests on adequate and independent state grounds,b,murdock,,sc-review,Federalism-protective doctrine.,murdock;federalism,false
scsr-036,scsr,3,'Adequate state grounds' must:,Support the result fully without federal help,Michigan v. Long's presumption authorizes Supreme Court review,The state court's interpretation of state law is not reviewable,Be constitutional,a,fox-films,,a-and-i,Doctrine focuses on whether state ground would resolve case.,fox-films;adequate,false
scsr-037,scsr,3,'Independent state grounds' must:,The state procedural ground is novel and inadequate to bar review,Be constitutional,Not be intertwined with federal-law analysis,Fox Films bars review where state ground supports the result,c,fox-films,,a-and-i,Independence avoids advisory opinion concern.,fox-films;independent,false
scsr-038,scsr,4,'Hypo: State court holds federal Constitution and state Constitution both require result; doesn't say which is dispositive.' Analysis:,The state-court judgment rests on adequate and independent state grounds,Michigan v. Long's presumption authorizes Supreme Court review,Apply Michigan v. Long: presume federal-law reliance,Dice v. Akron requires federal procedural law to govern,c,michigan-long,mich-long,a-and-i,"Without explicit invocation of independent state grounds, federal reliance presumed.",hypo;michigan-long,false
scsr-039,scsr,3,Federal procedural law preempts state procedural law in state court when:,State rule is outcome-determinative and frustrates federal policy,Testa v. Katt requires state courts to enforce the federal claim,Murdock v. Memphis limits review to federal-law questions only,The state-court judgment rests on adequate and independent state grounds,a,dice,,state-procedure,Felder/Dice: outcome-determinative state rules can be preempted.,dice;preemption,false
scsr-040,scsr,4,'Hypo: State court applies stricter pleading standard to federal civil rights claims than to analogous state claims.' Analysis:,Dice v. Akron requires federal procedural law to govern,The state-court judgment rests on adequate and independent state grounds,The state procedural ground is novel and inadequate to bar review,Discriminatory; preempted,d,brown,,state-procedure,Brown v. Western: heightened pleading for federal claims discriminates.,hypo;pleading,false
erie-002,erie,3,Erie R.R. v. Tompkins overruled Swift on the ground that:,Common law is non-binding,There is no federal general common law,Diversity is unconstitutional,States are paramount in everything,b,erie,,erie,Brandeis: lawmaking must trace to a sovereign; federal common law in diversity was unconstitutional.,erie;brandeis,false
erie-003,erie,2,Erie's constitutional rationale rests on:,Federal common law fills a gap left by the comprehensive federal scheme,The Rules Enabling Act limits this rule to procedure,Erie's positivism rationale precludes federal general common law,Federalism plus separation of powers,d,erie,,erie,Brandeis: states retain power to make their own common law; federal courts can't override.,erie;rationale,false
erie-006,erie,3,Erie's positivism point is that:,Law must trace to a sovereign,Customary law is supreme,Erie's positivism rationale precludes federal general common law,Common law is divine,a,erie,,erie,Legal positivism: no general law without a sovereign source.,erie;positivism,false
erie-007,erie,3,Hanna v. Plumer distinguishes between:,Boyle's three-prong contractor defense preempts state tort law,Sabbatino's act-of-state doctrine controls,FRCP application (Sibbach test) and state-law absent FRCP (Erie/York test),Clearfield Trust's federal-interest test displaces state law here,c,,,erie,Two-track analysis: REA-authorized rules vs. unguided Erie choice.,hanna;erie,false
erie-008,erie,3,The 'outcome-determinative' test (Guaranty Trust v. York) was:,Clearfield Trust's federal-interest test displaces state law here,Miree v. DeKalb directs application of state law where federal interest is incidental,Modified by Hanna,Kimbell Foods directs adoption of state law as the federal rule,c,,,erie,"Hanna: outcome-determinative test only applies to unguided Erie choice, not FRCP.",guaranty-trust;hanna;erie,false
erie-009,erie,2,Federal common law post-Erie exists in:,Lincoln Mills authorizes federal common-law development under § 301,Diversity only,Texas Industries forecloses an implied federal right of contribution,Enclaves where federal interest is compelling,d,clearfield,fcl-test,fcl,"Limited but real domain: Clearfield, Boyle, Sabbatino-style enclaves.",fcl;enclaves,false
erie-012,erie,3,Kimbell Foods exemplifies:,Erie commands application of forum-state substantive law,Federal common law fills a gap left by the comprehensive federal scheme,Sabbatino's act-of-state doctrine controls,Borrowing state law as the federal rule,d,kimbell,,fcl,"When uniformity isn't crucial, borrow state law to avoid disrupting commercial expectations.",kimbell;borrowing,false
erie-018,erie,3,'Delegated' federal common law arises from:,Statutory grant authorizing courts to develop common law,The Rules Enabling Act limits this rule to procedure,Hanna's twin aims point toward applying the federal rule,Sabbatino's act-of-state doctrine controls,a,lincoln-mills,,fcl,§ 301 LMRA in Lincoln Mills authorized labor common law.,fcl;delegated,false
erie-020,erie,3,FCL gap-filling is appropriate when:,Statute is silent across the board,Federal common law fills a gap left by the comprehensive federal scheme,Sabbatino's act-of-state doctrine controls,Statute clearly intends to cover field but lacks specific provisions,d,clearfield,,fcl,Common move: fill gaps in comprehensive federal scheme.,fcl;gap-filling,false
erie-021,erie,3,The 10th Amendment is relevant to FCL because:,It reserves residual lawmaking to states,Erie's positivism rationale precludes federal general common law,Article I supersedes,Hanna's twin aims point toward applying the federal rule,a,erie,,fcl,Federalism limit on judicial federal common-lawmaking.,fcl;federalism,false
erie-024,erie,4,'Hypo: Federal court must decide whether state-law statute of limitations bars federal § 1983 claim.' Analysis:,Miree v. DeKalb directs application of state law where federal interest is incidental,Borrow most analogous state SOL under federal common law,Lincoln Mills authorizes federal common-law development under § 301,Erie commands application of forum-state substantive law,b,,,fcl,Federal courts borrow state SOL for many federal causes of action.,hypo;sol,false
erie-025,erie,3,Federal common law for foreign relations:,The Rules Enabling Act limits this rule to procedure,"Recognized as enclave (Sabbatino, Boyle)",Texas Industries forecloses an implied federal right of contribution,Sabbatino's act-of-state doctrine controls,b,sabbatino,,fcl,FCL enclave for foreign-relations cases.,fcl;foreign-relations,false
erie-026,erie,3,Federal common law for admiralty:,Boyle's three-prong contractor defense preempts state tort law,Lincoln Mills authorizes federal common-law development under § 301,Clearfield Trust's federal-interest test displaces state law here,Recognized constitutionally and statutorily,d,,,fcl,Article III admiralty jurisdiction implies common-law authority.,fcl;admiralty,false
erie-027,erie,3,Federal common law for interstate disputes:,Texas Industries forecloses an implied federal right of contribution,Hanna's twin aims point toward applying the federal rule,Clearfield Trust's federal-interest test displaces state law here,Recognized for state-state controversies,d,,,fcl,Hinderlider: SC creates rules for state-state disputes.,fcl;interstate,false
erie-029,erie,3,'New' federal common law differs from Swift's because:,It is enclave-bounded and tied to federal interest,Lincoln Mills authorizes federal common-law development under § 301,The Rules Enabling Act limits this rule to procedure,Erie's positivism rationale precludes federal general common law,a,clearfield,,fcl,"Limited and federal-interest-justified, not general.",fcl;new,false
erie-035,erie,3,Boyle's three-part contractor defense requires:,Boyle's three-prong contractor defense preempts state tort law,Clearfield Trust's federal-interest test displaces state law here,"Reasonably precise specifications, conformance, warning of dangers",Sabbatino's act-of-state doctrine controls,c,boyle,,fcl,Conditions for displacement of state tort liability.,boyle;factors,false
erie-037,erie,3,Erie's 'twin aims' (Hanna) include:,Kimbell Foods directs adoption of state law as the federal rule,Lincoln Mills authorizes federal common-law development under § 301,Discouraging forum shopping and avoiding inequitable administration,Clearfield Trust's federal-interest test displaces state law here,c,,,erie,Hanna's gloss on Erie's policy.,erie;twin-aims,false
erie-041,erie,3,The 'expansion' of general law before Erie produced:,Federal courts ignoring state innovations,Texas Industries forecloses an implied federal right of contribution,Lincoln Mills authorizes federal common-law development under § 301,Miree v. DeKalb directs application of state law where federal interest is incidental,a,gelpcke,,erie,Spurred Erie's rejection of general common law.,gelpcke;erie,false
erie-042,erie,3,Erie shaped federal-state balance in diversity by:,Mandating federal common law,Erie commands application of forum-state substantive law,Federal common law fills a gap left by the comprehensive federal scheme,Requiring federal courts to apply state substantive law,d,erie,,erie,Diversity courts apply forum state's substantive law.,erie;diversity,false
erie-046,erie,3,Ed Boyle's contractor defense was:,Erie commands application of forum-state substantive law,Lincoln Mills authorizes federal common-law development under § 301,Boyle's three-prong contractor defense preempts state tort law,Federal common law preempting state product-liability,d,boyle,,fcl,FCL preemption of state tort law.,boyle;preemption,false
erie-049,erie,3,'Implied causes of action' relate to FCL because:,Miree v. DeKalb directs application of state law where federal interest is incidental,They involve courts inferring remedies from federal statutes,Texas Industries forecloses an implied federal right of contribution,Sabbatino's act-of-state doctrine controls,b,sandoval,,fcl,PROAs occupy the netherworld between FCL and statutory interpretation.,fcl;proa,false
erie-054,erie,4,'Hypo: District court must decide forfeiture rule for U.S. checks under federal program with no specific federal rule.' Analysis:,Erie commands application of forum-state substantive law,Apply federal common law (Clearfield),Boyle's three-prong contractor defense preempts state tort law,Texas Industries forecloses an implied federal right of contribution,b,clearfield,fcl-test,fcl,Clearfield's domain.,hypo;clearfield,false
roa-009,roa,3,'Comprehensive remedial scheme' analysis asks:,Whether Congress provided alternative enforcement that suggests no PROA,Egbert effectively bars any new Bivens context,Carlson v. Green's 8A holding preserves only the original context,FTCA provides an adequate alternative remedy that defeats Bivens,a,sandoval,,proa,Detailed remedial scheme suggests Congress intended its remedies to be exclusive.,sandoval;remedial-scheme,false
roa-021,roa,3,Hui v. Castaneda declined Bivens because:,Malesko bars Bivens against private-corporation defendants,Wilkie's unworkability concern defeats this Bivens extension,Sandoval requires rights-creating language and statutory structure,FTCA was 'exclusive remedy' under Public Health Act,d,,,bivens,Statutory exclusivity defeated Bivens.,hui;bivens,false
roa-025,roa,4,Hernandez v. Mesa declined Bivens because:,Wilkie's unworkability concern defeats this Bivens extension,Cross-border shooting = new context + foreign relations,The comprehensive remedial scheme forecloses an implied private right,Cort v. Ash's four-factor analysis is no longer controlling,b,hernandez,bivens-extension,bivens,Foreign-relations special factor.,hernandez;bivens,true
roa-027,roa,3,Egbert collapsed Abbasi's two-step into:,Hernandez's foreign-relations special factor controls,Touche Ross's narrowing of implied PROAs governs,Cort v. Ash's four-factor analysis is no longer controlling,Single step: any rational reason favoring Congress,d,egbert,bivens-extension,bivens,Effectively bars almost all Bivens extensions.,egbert;collapse,false
roa-033,roa,3,Why didn't the Bivens plaintiffs use § 1983?,Hernandez's foreign-relations special factor controls,Touche Ross's narrowing of implied PROAs governs,§ 1983 reaches state actors only,The comprehensive remedial scheme forecloses an implied private right,c,bivens,,bivens,Federal officers aren't state actors under § 1983.,bivens;1983-distinction,false
roa-035,roa,3,Carlson noted that Bivens may add to FTCA because:,Hernandez's foreign-relations special factor controls,FTCA's state-law-based remedies aren't equivalent,Egbert effectively bars any new Bivens context,Wilkie's unworkability concern defeats this Bivens extension,b,carlson,,bivens,Bivens damages can exceed FTCA recoveries.,carlson;ftca,false
roa-036,roa,3,'Special factors' that defeat Bivens often include:,Hernandez's foreign-relations special factor controls,The comprehensive remedial scheme forecloses an implied private right,FTCA provides an adequate alternative remedy that defeats Bivens,"Military, national security, foreign affairs",d,abbasi,bivens-extension,bivens,Recurring special factor categories.,abbasi;special-factors,false
roa-040,roa,3,'Comprehensive remedial scheme' under Sandoval is similar to:,Bivens cannot be extended where any rational reason favors Congress,Wilkie's unworkability concern defeats this Bivens extension,Sandoval requires rights-creating language and statutory structure,'Special factors' under Bivens,d,sandoval,,proa,Both ask whether Congress's enforcement choices are exclusive.,sandoval-bivens;parallel,false
roa-053,roa,3,'Implied PROA' for constitutional violations against state officers:,The comprehensive remedial scheme forecloses an implied private right,Hernandez's foreign-relations special factor controls,FTCA provides an adequate alternative remedy that defeats Bivens,§ 1983 supplies the express PROA,d,thiboutot,,proa,Constitutional claims against state actors go through § 1983.,1983-constitutional,false
roa-054,roa,3,'Implied PROA' for constitutional violations against federal officers:,Sandoval requires rights-creating language and statutory structure,The comprehensive remedial scheme forecloses an implied private right,Bivens,Malesko bars Bivens against private-corporation defendants,c,bivens,,bivens,Bivens fills gap for federal officers.,bivens-1983;mapping,false
roa-059,roa,3,Hernandez v. Mesa's foreign-relations special factor reflects:,Court's reluctance to extend Bivens internationally,Bivens cannot be extended where any rational reason favors Congress,Malesko bars Bivens against private-corporation defendants,FTCA provides an adequate alternative remedy that defeats Bivens,a,hernandez,bivens-extension,bivens,International contexts treated as inherently unsuitable for Bivens.,hernandez;foreign,false
roa-061,roa,4,'Hypo: Plaintiff seeks damages from federal officer for First Amendment retaliation.' Bivens analysis:,Likely no Bivens (Egbert applied to 1A),Wilkie's unworkability concern defeats this Bivens extension,The comprehensive remedial scheme forecloses an implied private right,Egbert effectively bars any new Bivens context,a,egbert,bivens-extension,bivens,Egbert applied to 1A retaliation.,hypo;egbert-1a,false
imm-012,imm,3,Seminole Tribe v. Florida held:,Seminole Tribe forecloses Article I abrogation of SSI,§ 1983 personal-capacity suits escape Eleventh Amendment SSI,Article I cannot abrogate SSI,Article I can abrogate,c,seminole,seminole-abrog,abrogation,Modern abrogation rule for Article I powers.,seminole;abrogation,false
imm-016,imm,3,Tennessee v. Lane upheld ADA Title II abrogation as:,Applied to fundamental access to courts,Stump v. Sparkman extends judicial immunity to outrageous orders,Plan-of-convention waiver controls under Katz/Torres,Edelman v. Jordan limits Young to prospective relief,a,lane,seminole-abrog,abrogation,As-applied analysis succeeded.,lane;ada,false
imm-018,imm,3,Torres v. TX DPS extended plan of convention to:,War powers,Section 5 of the Fourteenth Amendment abrogates state sovereign immunity,Bankruptcy only,§ 1983 personal-capacity suits escape Eleventh Amendment SSI,a,torres,plan-conv,abrogation,USERRA suit allowed despite Article I underpinning.,torres;war,false
imm-019,imm,3,PennEast Pipeline applied plan of convention to:,Plan-of-convention waiver controls under Katz/Torres,"Monell requires policy or custom, not respondeat superior",Canton's deliberate-indifference standard governs failure-to-train,Eminent domain,d,penneast,plan-conv,abrogation,NJ couldn't assert SSI against pipeline condemnation.,penneast;eminent-domain,false
imm-020,imm,3,Ex parte Young's officer-suit fiction is:,Connick narrows Canton failure-to-train to require pattern,Fitzpatrick v. Bitzer authorizes congressional abrogation under § 5,§ 1983 personal-capacity suits escape Eleventh Amendment SSI,Necessary to vindicate federal rights against unconstitutional state action,d,expaul,ex-parte-young,ssi,Federalism balance: prospective injunctions allowed.,expaul;fiction,false
imm-029,imm,3,Monell v. NYC DSS overruled part of Monroe to hold:,Pearson v. Callahan permits courts to skip the constitutional question,§ 1983 personal-capacity suits escape Eleventh Amendment SSI,Plan-of-convention waiver controls under Katz/Torres,Municipalities are persons under § 1983 but only liable for policy/custom,d,monell,monell-mun,sec1983,Municipal liability under § 1983.,monell;1983,true
imm-033,imm,3,Connick v. Thompson narrowed failure-to-train by:,Permitting single violation,"Monell requires policy or custom, not respondeat superior","Requiring pattern, not single Brady violation",Pennhurst forbids Young from enforcing state law against the state,c,connick,canton-train,sec1983,Even egregious single violations are insufficient.,connick;train,false
imm-055,imm,3,Imbler v. Pachtman held prosecutors immune for:,Advocacy functions,Qualified immunity defeats the damages claim under Harlow,§ 1983 personal-capacity suits escape Eleventh Amendment SSI,Investigatory functions,a,imbler,,absolute,Absolute immunity for trial-related activities.,imbler;prosecutors,false
imm-064,imm,3,'Plan of convention' abrogation rests on:,Connick narrows Canton failure-to-train to require pattern,Stump v. Sparkman extends judicial immunity to outrageous orders,Will v. Michigan State Police bars suit against the state itself,Implicit waiver of SSI in granted federal powers,d,katz,plan-conv,abrogation,Implicit in plan of ratification.,plan-of-convention;abrogation,false
imm-066,imm,4,'Hypo: Plaintiff sues state under FLSA for unpaid overtime.' Analysis:,Likely barred by Seminole/Alden absent valid abrogation,Qualified immunity defeats the damages claim under Harlow,Fitzpatrick v. Bitzer authorizes congressional abrogation under § 5,Section 5 of the Fourteenth Amendment abrogates state sovereign immunity,a,seminole,seminole-abrog,abrogation,FLSA abrogation under Article I commerce was struck down (Alden).,hypo;flsa,false
